{"schemaVersion":"1.0.0","reportId":"ra_01j3repositoryaudit","generatedAt":"2026-07-28T03:10:00Z","mode":"analyze-only","engine":{"name":"SolveLang Repository Audit","version":"0.1.0","rulesetVersion":"2026-07-28","deterministic":true},"source":{"kind":"github","displayName":"example/automation-app","repositoryUrl":"https://github.com/example/automation-app","defaultBranch":"main","revision":"87cd32086599daab626f59abf675fe712d11bf19","fingerprint":"sha256:1111111111111111111111111111111111111111111111111111111111111111","private":false},"limits":{"maxFiles":50000,"maxTotalBytes":536870912,"maxFileBytes":10485760,"maxArchiveEntries":100000,"maxDepth":64,"maxFindings":5000,"timeoutMs":300000},"execution":{"startedAt":"2026-07-28T03:09:54Z","finishedAt":"2026-07-28T03:10:00Z","status":"complete","truncated":false,"truncationReasons":[],"networkAccess":false,"writeAccess":false,"errors":[]},"summary":{"filesScanned":184,"filesSkipped":2,"bytesScanned":2459921,"directoriesSeen":31,"findingsBySeverity":{"critical":0,"high":1,"medium":1,"low":0,"info":1},"actionsByType":{"keep":1,"review":1,"move":0,"merge":0,"rewrite":0,"delete-candidate":1}},"inventory":{"languages":[{"name":"TypeScript","confidence":{"level":"high","score":0.99,"basis":"Extensions and package manifests agree."},"evidence":[{"path":"package.json","kind":"manifest"}]}],"frameworks":[{"name":"Next.js","version":"15","confidence":{"level":"high","score":0.98,"basis":"Declared dependency and app directory detected."},"evidence":[{"path":"package.json","kind":"manifest"},{"path":"app","kind":"directory"}]}],"packageManagers":[{"name":"npm","confidence":{"level":"high","score":1,"basis":"package-lock.json is present."},"evidence":[{"path":"package-lock.json","kind":"manifest"}]}],"deploymentTargets":[{"name":"GitHub Actions","confidence":{"level":"high","score":1,"basis":"Workflow definitions are present."},"evidence":[{"path":".github/workflows/ci.yml","kind":"config"}]}],"fileClasses":[{"class":"source","count":96},{"class":"test","count":31},{"class":"documentation","count":12},{"class":"configuration","count":18},{"class":"generated","count":20},{"class":"vendor","count":0},{"class":"asset","count":5},{"class":"archive","count":1},{"class":"backup","count":1},{"class":"unknown","count":0}],"largeFiles":[{"path":"fixtures/sample-export.json","kind":"size","byteSize":7340032,"note":"Large tracked fixture; review whether a smaller deterministic fixture is sufficient."}]},"detections":{"duplicates":[{"groupId":"dup_01j3exactpair","matchType":"exact-content","confidence":{"level":"high","score":1,"basis":"Files have the same SHA-256 digest."},"members":[{"path":"src/config.ts","kind":"hash","sha256":"2222222222222222222222222222222222222222222222222222222222222222"},{"path":"src/config.backup.ts","kind":"hash","sha256":"2222222222222222222222222222222222222222222222222222222222222222"}]}],"backupCandidates":[{"path":"src/config.backup.ts","kind":"name-pattern","note":"Filename matches a backup convention."}],"generatedCandidates":[{"path":"dist/app.js","kind":"generated-marker","note":"Build output marker and dist path detected."}],"secretExposureWarnings":[{"warningId":"sec_01j3exampletoken","path":"public/debug.txt","lineStart":4,"lineEnd":4,"patternClass":"token","exposure":"public-path","redacted":true,"fingerprint":"hmac-sha256:3333333333333333333333333333333333333333333333333333333333333333","remediation":"Remove the tracked value, rotate the credential outside SolveLang, and verify repository history and deployed public assets."}]},"findings":[{"id":"raf_01j3publicsecret","ruleId":"RA050","category":"secrets","severity":"high","title":"Secret-shaped value is tracked in a public path","status":"open","recommendation":"review","explanation":"A secret pattern was detected. The value is intentionally omitted from this report.","confidence":{"level":"high","score":0.97,"basis":"Pattern class and public-path evidence agree."},"impact":"A tracked credential may be retrievable from source history or deployed public assets.","evidence":[{"path":"public/debug.txt","kind":"public-exposure","lineStart":4,"lineEnd":4,"excerpt":"[REDACTED token fingerprint sec_01j3exampletoken]"}],"destructive":false,"approvalRequired":false,"validation":["Confirm the file is no longer tracked or deployed.","Verify the credential was rotated using the provider's own controls."],"rollback":[],"tags":["security","public-exposure"]},{"id":"raf_01j3backuppairxx","ruleId":"RA012","category":"backup-files","severity":"medium","title":"Tracked backup file duplicates an active source file","status":"open","recommendation":"delete-candidate","explanation":"The backup-named file is byte-for-byte identical to the active source file.","confidence":{"level":"high","score":1,"basis":"Exact content hashes match and the filename has a backup suffix."},"impact":"Keeping duplicate backup files increases maintenance ambiguity and may preserve stale code.","evidence":[{"path":"src/config.ts","kind":"hash","sha256":"2222222222222222222222222222222222222222222222222222222222222222"},{"path":"src/config.backup.ts","kind":"name-pattern","sha256":"2222222222222222222222222222222222222222222222222222222222222222"}],"destructive":true,"approvalRequired":true,"validation":["Run the repository test and build commands after removal.","Search for direct references to the backup path."],"rollback":["Restore the file from the dedicated cleanup branch commit."],"tags":["duplicate","backup"]},{"id":"raf_01j3generatedout","ruleId":"RA020","category":"generated-files","severity":"info","title":"Generated output is tracked","status":"open","recommendation":"keep","explanation":"The generated file is tracked and may be intentional for static deployment.","confidence":{"level":"medium","score":0.74,"basis":"Path and generated marker match, but deployment intent is unknown."},"impact":"Tracked output can be valid, but should have a documented reproducibility policy.","evidence":[{"path":"dist/app.js","kind":"generated-marker"}],"destructive":false,"approvalRequired":false,"validation":["Document how the artifact is reproduced and verified."],"rollback":[],"tags":["generated"]}],"redaction":{"policyVersion":"1.0.0","secretValuesIncluded":false,"pathNormalization":"repository-relative-posix","contentExcerptPolicy":"redacted-lines-only","redactedMatchCount":1},"integrity":{"canonicalJsonSha256":"sha256:a175d4e21207112b2cae4e274383ed087b6c19d22d74d4ad9c613f9345d6b1b3","findingOrder":"severity-desc-rule-id-path-line","stableIds":true}}
